{
  "id": "anna-abraham",
  "name": "Anna Abraham",
  "role": "Accountant",
  "bio": "I was born at the base of Mount Meru near Arusha National Park. When I was in primary school, I used to visit Arusha National Park regularly as part of outreach programs for the local community. These visits sparked my fascination with birds, especially the flamingos in Lake Momela, as well as various animals and waterfalls. My relatives were pioneers in tourism, and I grew up watching my uncles work as tour guides and with large tour companies. This exposure instilled in me a deep love for everything related to tourism.\nAfter completing my secondary education, I went to college and graduated with a certificate in Education. I worked as a teacher in several schools, but my passion for tourism remained strong. To pursue this passion, I took a short course in Tourism and Accounts. No challenge was too great for me to take on while staying focused on my vision.\nI joined Mazingira Safaris as an Accountant, where I oversee daily office operations, including accounts, manage safari guides, and handle all other logistics.",
  "photo": null
}
