{
  "id": "tumsifu",
  "name": "Tumsifu (Thom)",
  "role": "Safari Tour Guide",
  "bio": "My name is Tumsifu, but I'm known as Thom. I grew up herding my family's livestock near Arusha National Park and Mount Meru, where I developed a fascination for wildlife. After completing secondary school in 2006, driven by my love for nature, I enrolled in a private college in Arusha in 2007, specializing in tour guiding and wildlife management.\nI began my career in 2008 as a campsite attendant before advancing to roles as a waiter, truck driver, game package guide, and ultimately a safari guide. With over 13 years in the tourism industry, I joined the Mazingira team in 2020 because their values aligned perfectly with my passion for nature and tourism. Working with them has shown me how richly blessed our beautiful country is.\nOne of my favorite moments is watching the sun set over the umbrella acacia trees in the western Serengeti. I also cherish the varied sounds of animals at night during the wildebeest migration. My motto is to embrace the untamed beauty of Tanzania.",
  "photo": null
}
