{
  "id": "solomon-akyoo",
  "name": "Solomon Akyoo (Daniel)",
  "role": "Safari Tour Guide",
  "bio": "Also known as ‘Daniel’, I was born and raised in Ngarenanyuki at the base Mount Meru bordering Arusha National Park to the south. Following his grandfather footprints as a tour guide and his father as a forest reserve officer, he grew loving nature including feeding random birds flying to their home when he was a kid.\nDaniel studied full course of tour guiding aiming on mammals, trees and flowers and Marine parks. After several training on animal’s behavior, Daniel understands animals extensively. Apart from his comprehensive knowledge in flora and fauna, he is great in leadership and customer service. His special interest is on birds as he found colorful birds very beautiful.\nSince 2010 he has lead multiple safaris in Tanzania and beyond borders. Daniel is very good in private game drives taking his clients away from crowds and common routes something that makes him quite unique.",
  "photo": null
}
