{
  "id": "leonard-eddie-belle",
  "name": "Leonard Eddie Belle",
  "role": "Safari Tour Guide",
  "bio": "I am Leonard, born and raised in the Arusha region, the heart of tourism in Tanzania. Seeing many safari vehicles filled with tourists sparked my passion for wildlife. After secondary school, I pursued my dream at the College of African Wildlife Management in Mweka, where I earned a diploma in wildlife management. To further refine my skills, I obtained a Level One certification from the Field Guide Association of Southern Africa (FGASA) while working as a resident guide in the Southern circuit.\nWith the knowledge and experience I've gained, I've become one of the top safari guides for both the Northern and Southern circuit parks. I take great joy in meeting and interacting with people from around the world who visit Tanzania. Sharing my knowledge and experiences with guests ensures they enjoy the best safari possible and leave with unforgettable memories.",
  "photo": null
}
