{
  "id": "david-raston",
  "name": "David Raston",
  "role": "Safari Tour Guide",
  "bio": "I am David Raston, born in Arusha and grew up working on family projects focused on agriculture and biology, which sparked my passion for nature. Later, I pursued my interest in wildlife studies at university, graduating with a BSc in Wildlife Management. From that point on, I dedicated my life to nature conservation.\nI joined the Mazingira team in 2016 and have been sharing my wildlife and cultural knowledge with our valued clients and friends about various destinations ever since. Working with the Mazingira team brings me joy because it allows me to practice my service at its best. We all share a commitment to professional service delivery, whether it's in nature or hospitality.\nOne of the most striking experiences in my career was witnessing how nature can be both beautiful and harsh. During the wildebeest calving season, I watched a baby wildebeest being born, only to be hunted by a cheetah an hour later. Moments like these capture the raw reality of the natural world.",
  "photo": null
}
