{
  "id": "jacob-s-kereiya",
  "name": "Jacob S. Kereiya",
  "role": "CEO/Founder, Tour Consultant",
  "bio": "Hello from Mazingira Safaris! I'm Jacob, the Director here, and I’m delighted to share my story with you. My journey in the world of safari began over 15 years ago, guiding guests through the breathtaking landscapes of Tanzania. Having worked with top-tier safari companies including Kibo Guide Safari, Sokwe Asilia, Nomad Tanzania, and Wayo Africa, I've gathered a wealth of experience and a deep love for this land and its wildlife.\nThrough my years as a guide, I've had the privilege of introducing adventurers from around the world to the wonders of the Serengeti, the mysteries of Ngorongoro, and beyond. This experience has not only honed my skills but deepened my commitment to conservation and responsible tourism.\nHere at Mazingira Safaris, my team and I are dedicated to crafting unforgettable safari experiences. We're passionate about sharing the beauty of Tanzania with you, helping to plan your dream safari with all the insights and personal touches that only a local expert can provide. Join us to discover the magic of Tanzania, and let us turn your safari dreams into reality.",
  "photo": null
}
