{
  "id": "johari-msangi",
  "name": "Johari Msangi",
  "role": "Travel Specialist",
  "bio": "I am Johari, a proud Tanzanian born and raised on the slopes of Mount Kilimanjaro in the Kilimanjaro region. This region is famous for its remarkable attractions, particularly the majestic Mount Kilimanjaro, the tallest free-standing mountain in Africa. Growing up with breathtaking views of the peak every morning and evening, I knew from an early age that I wanted to work in tourism. My passion was further inspired by family members who worked as porters and mountain guides on the mountain.\nAfter finishing secondary school, I pursued a Bachelor's degree in Tourism and Cultural Heritage at the University of Dodoma. During my studies in 2013, I had the incredible opportunity to climb Mount Kilimanjaro via the Marangu route and reach the summit at Uhuru Peak, 5895 meters above sea level, earning a certificate. It was a significant milestone in achieving my dreams.\nDespite working outside the tourism industry for a while, gaining valuable customer service experience, my heart remained with my passion. I sought a path back into my dream field and found my way to Mazingira Eco Friendly Safari Adventures, where I now work as a travel and tour consultant. This role lets me connect with clients worldwide and refine my skills to craft remarkable trips to Tanzania and Africa.\nMy dream is to become one of the most successful women in Tanzania's travel industry. I am excited to welcome you to Tanzania and Africa with professionalism and excellent customer service.\nKaribu!",
  "photo": null
}
