{
  "id": "daniel-fredrick",
  "name": "Daniel Fredrick",
  "role": "Safari Tour Guide",
  "bio": "I am Daniel Fredrick, born and raised in a community that practiced agriculture and animal husbandry on the border of Arusha National Park. My brother, who worked as a guide, often took me on nature walks through conservation areas, teaching me about the rich flora and fauna before I began college in 2007. Over the past 14 years, I've dedicated my life to nature and tourism, working as a professional safari guide in Tanzania.\nWorking with the Mazingira team brings me immense joy, as our shared pursuit of service excellence unites us. Our mutual values of delivering professional service in both nature and hospitality fuel my success.\nThere have been many memorable moments in my career, but witnessing the beauty of the Great Migration stands out. Observing millions of wildebeest and zebras crossing the Mara River into Kenya was a truly fascinating spectacle and an unforgettable highlight.",
  "photo": null
}
